{
  "$schema": "https://json-schema.org/draft/2020-12/schema",
  "$id": "grant-audit-transparency-log-v1.schema.json",
  "title": "Grant Audit Transparency Log v1",
  "type": "object",
  "required": [
    "schema",
    "log_version",
    "created_at",
    "updated_at",
    "entry_count",
    "head_entry_hash",
    "log_root",
    "entries"
  ],
  "properties": {
    "schema": {
      "type": "string",
      "const": "grant-audit-transparency-log-v1"
    },
    "log_version": {
      "type": "string"
    },
    "created_at": {
      "type": "string",
      "format": "date-time"
    },
    "updated_at": {
      "type": "string",
      "format": "date-time"
    },
    "entry_count": {
      "type": "integer",
      "minimum": 0
    },
    "head_entry_hash": {
      "anyOf": [
        {
          "type": "string",
          "pattern": "^[a-f0-9]{64}$"
        },
        {
          "type": "null"
        }
      ]
    },
    "log_root": {
      "anyOf": [
        {
          "type": "string",
          "pattern": "^[a-f0-9]{64}$"
        },
        {
          "type": "null"
        }
      ]
    },
    "entries": {
      "type": "array",
      "items": {
        "$ref": "./grant-audit-transparency-log-entry-v1.schema.json"
      }
    }
  },
  "additionalProperties": false
}
