{
  "schema": "grant-audit-transparency-log-v1",
  "log_version": "1.0.0",
  "created_at": "2026-03-07T02:08:10.363Z",
  "updated_at": "2026-03-07T02:08:10.363Z",
  "entry_count": 1,
  "head_entry_hash": "acd5f7f90d58cc9c558c32d3547dc30beb03beb61cb04d201b665e889c1f794e",
  "log_root": "17425158cd0adf067564abfe44726ea5a0b03f07472cb9c438cd24c8768662ef",
  "entries": [
    {
      "schema": "grant-audit-transparency-log-entry-v1",
      "entry_version": "1.0.0",
      "index": 0,
      "appended_at": "2026-03-07T02:08:10.363Z",
      "packet_manifest_hash": "aa6b4994839c8a90c81e982c3174f6f52f9f3e1036524508af1e401e6b2a8209",
      "transparency_manifest_hash": "9320f521c042ec7fcb89780bc051e2db1c4eea232088bc382489b3baa0ff5d6c",
      "lifecycle_status": "active",
      "bound_block_number": 38539945,
      "prev_entry_hash": null,
      "entry_hash": "acd5f7f90d58cc9c558c32d3547dc30beb03beb61cb04d201b665e889c1f794e",
      "packet_path": "evidence/phase-7.11/transparency-manifest.json",
      "notes": [
        "Initial transparency log entry from Phase 7.11"
      ]
    }
  ]
}
