{
  "schema": "grant-audit-transparency-log-v1",
  "log_version": "1.0.0",
  "created_at": "2026-03-07T02:08:10.363Z",
  "updated_at": "2026-03-07T18:00:00.000Z",
  "entry_count": 3,
  "head_entry_hash": "596b4033f1d2e838f849e28e8923b766d8591e496aeaa943ca12072f177ebbbe",
  "log_root": "e2f2d0522e4e7f3fad81640368dd37b3844166fd060c9e82a6d0250ed2a3d2d7",
  "entries": [
    {
      "appended_at": "2026-03-07T02:08:10.363Z",
      "bound_block_number": 38539945,
      "cumulative_root": "acd5f7f90d58cc9c558c32d3547dc30beb03beb61cb04d201b665e889c1f794e",
      "entry_hash": "acd5f7f90d58cc9c558c32d3547dc30beb03beb61cb04d201b665e889c1f794e",
      "entry_version": "1.0.0",
      "index": 0,
      "lifecycle_status": "active",
      "notes": [
        "Initial transparency log entry from Phase 7.11"
      ],
      "packet_manifest_hash": "aa6b4994839c8a90c81e982c3174f6f52f9f3e1036524508af1e401e6b2a8209",
      "packet_path": "evidence/phase-7.11/transparency-manifest.json",
      "prev_entry_hash": null,
      "schema": "grant-audit-transparency-log-entry-v1",
      "transparency_manifest_hash": "9320f521c042ec7fcb89780bc051e2db1c4eea232088bc382489b3baa0ff5d6c"
    },
    {
      "appended_at": "2026-03-07T18:00:00.000Z",
      "artifact": {
        "artifact_hash": "634b50c332003706b533aa8379d616640f9e1021b76ab756c3e342474492eee6",
        "event_sequence": 1,
        "event_type": "vesting",
        "grant_id": "GRANT-2026-0001",
        "lifecycle_event_hash": "6fd9a93ec01c84f3af64faa5c7d3c5adf78816a96a41092ec87354257aabce76",
        "lifecycle_event_id": "GRANT-2026-0001-vesting-0001",
        "path": "manifests/grants/grant-lifecycle-event.json",
        "schema": "grant-audit-grant-lifecycle-event-v1"
      },
      "entry_hash": "8df8f6abfe36b04a8ccb15cb8c29ffc8fc09e6958ef0a24e27de94dbe89ee35a",
      "entry_type": "grant_lifecycle_event",
      "entry_version": "1.0.0",
      "index": 1,
      "leaf_hash": "e61bc4b8b613f278527e65d25dfd73728e8be9e0181bb1b0dfd9d7cc0f5ed950",
      "lineage": {
        "checkpoint_reference_path": "manifests/transparency/checkpoint-finalization.json",
        "issuance_anchor_reference_path": "manifests/transparency/issuance-anchor.json",
        "issuance_artifact_path": "manifests/grants/grant-issuance.json",
        "lifecycle_lineage_hash": "3f6af96cf6977059b12f1181317b794569ae0cc93555814af7630700224d9e86",
        "root_anchor_network": "base-sepolia",
        "transparency_log_path": "manifests/transparency/transparency-log.json",
        "trust_chain_hash": "c63c62bae033514b457c8c6b11f9438f85fa9b4cca3e0d748290407147dd252f"
      },
      "schema": "grant-audit-transparency-lifecycle-log-entry-v1"
    },
    {
      "schema": "grant-audit-transparency-log-entry-v1",
      "entry_version": "1.0.0",
      "index": 2,
      "appended_at": "2026-03-07T18:00:00.000Z",
      "prev_entry_hash": "8df8f6abfe36b04a8ccb15cb8c29ffc8fc09e6958ef0a24e27de94dbe89ee35a",
      "artifact_type": "lifecycle_replay_reconciliation",
      "artifact_schema": "grant-audit-transparency-lifecycle-replay-log-entry-v1",
      "artifact_manifest_path": "manifests/transparency/lifecycle-replay-transparency-log-entry.json",
      "artifact_hash": "9a6ecf2adc330e03a296d2f44014f1b128eb9f484edbaecdbdf37e425a965b7b",
      "grant_id": "GRANT-2026-0001",
      "reconciliation_status": "match",
      "reconciliation_hash": "351b902eb685be752d5d3d4142c133e821b316728664d9be88661f053cc54917",
      "entry_hash": "596b4033f1d2e838f849e28e8923b766d8591e496aeaa943ca12072f177ebbbe"
    }
  ]
}
