{
  "created_at": "2026-03-07T03:15:00.000Z",
  "entries": [
    {
      "appended_at": "2026-03-07T03:15:00.000Z",
      "cumulative_root": "9e51a0e7a6152ecad4967ac3533f3c78b15377a80e9fca3d0c5fec18a1a8cec6",
      "entry_hash": "2a402c25cd185ffa313de1134e3c64bce17c9798a1a16db3d503a484d2819564",
      "entry_version": "1.0.0",
      "index": 0,
      "packet_hash": "ba93f918b7257bb9a73996ddbee67b1a013aefcc933322a71b3a352e11da369d",
      "packet_ref": "fixture/audit-packets/packet-001.json",
      "previous_cumulative_root": "0000000000000000000000000000000000000000000000000000000000000000",
      "previous_entry_hash": "0000000000000000000000000000000000000000000000000000000000000000",
      "schema": "grant-audit-transparency-log-entry-v1"
    }
  ],
  "entry_count": 1,
  "head_entry_hash": "2a402c25cd185ffa313de1134e3c64bce17c9798a1a16db3d503a484d2819564",
  "log_root": "9e51a0e7a6152ecad4967ac3533f3c78b15377a80e9fca3d0c5fec18a1a8cec6",
  "log_version": "1.0.0",
  "schema": "grant-audit-transparency-log-v1",
  "updated_at": "2026-03-07T03:15:00.000Z"
}
